article_id,source_name,source_url,publisher_type,title,author,published_at,collected_at,language,region,full_text,word_count,summary,summary_model,summary_prompt_version
article_0001,The-independent.com,https://www.the-independent.com/tv/culture/robbie-williams-ai-music-video-b2956048.html,news_website,Robbie Williams admits using AI in writing: ‘It knows me back to front’,Holly Patrick,2026-04-12T09:52:40Z,2026-04-13T09:55:20Z,en,Global,"Robbie Williams admits using AI in writing: ‘It knows me back to front’ Robbie Williams says that he has used artificial intelligence to help him with writing on his Instagram page. Robbie Williams says that he has used artificial intelligence to help him with writing on his Instagram page. The former Take That star, 52, spoke to CNBC as he celebrated 30 years as a solo artist.…",67,"Robbie Williams has revealed that he uses artificial intelligence (AI) to assist with writing. He stated that the AI ""knows me back to front"" implying it has a good understanding of his style and work. This admission came during an interview on CNBC to mark 30 years as a solo artist. Williams made this comment about using AI on his Instagram page, but the article does not specify which particular projects or songs were assisted by AI.",llama3.1:8b,v1
article_0002,Ibtimes.com.au,https://www.ibtimes.com.au/nvidia-stock-2026-buy-sell-nvda-ai-demand-blackwell-ramp-fuel-strong-buy-consensus-1866225,news_website,NVIDIA Stock 2026: Buy or Sell NVDA as AI Demand and Blackwell Ramp Fuel Strong Buy Consensus,Tony Jackson,2026-04-12T09:36:29Z,2026-04-13T09:55:20Z,en,Global,"NVIDIA Stock 2026: Buy or Sell NVDA as AI Demand and Blackwell Ramp Fuel Strong Buy Consensus NEW YORK — NVIDIA Corp. (NASDAQ: NVDA) shares closed at approximately $188.63 on April 10, 2026, with Wall Street analysts maintaining a strong consensus ""Buy"" or ""Strong Buy"" rating as the company rides explosive demand for its AI GPUs, particularly the Blac… NEW YORK — NVIDIA Corp. (NASDAQ: NVDA) shares closed at approximately $188.63 on April 10, 2026, with Wall Street analysts maintaining a strong consensus ""Buy"" or ""Strong Buy"" rating as the company r…",92,"NVIDIA's stock price was around $188.63 on April 10, 2026. Analysts have a strong buy consensus for NVDA, driven by high demand for AI GPUs and NVIDIA's Blackwell product. The company's AI GPU sales are fueling this optimistic outlook. Despite the market performance, analysts maintain their ""Buy"" or ""Strong Buy"" rating. Overall, investors are advised to consider buying NVDA stock based on current analyst sentiment.",llama3.1:8b,v1
article_0003,The Indian Express,https://indianexpress.com/article/technology/tech-news-technology/france-shift-windows-linux-reflects-digital-sovereignty-push-10632508/,news_website,How France’s shift from Windows to Linux reflects broader push for digital sovereignty,Tech Desk,2026-04-12T09:32:23Z,2026-04-13T09:55:20Z,en,Global,"How France’s shift from Windows to Linux reflects broader push for digital sovereignty This is the latest step by France to reduce reliance on US tech giants and strengthen its digital sovereignty by adopting locally developed software and cloud services. France seems to be gearing up for a major shift in its public sector tech stack, as the government looks to move several Windows-powered computers to Linux in an effort to cut dependence on US-based …",76,France is transitioning from Windows to Linux in a bid to reduce its reliance on US tech giants and promote digital sovereignty. This move is part of the country's efforts to adopt locally developed software and cloud services. The shift aims to strengthen France's independence in the digital sphere. Several Windows-powered computers are set to be replaced with Linux-based systems. This initiative reflects France's broader push for self-sufficiency in technology.,llama3.1:8b,v1
article_0004,Slate Magazine,https://slate.com/podcasts/what-next-tbd/2026/04/sam-altman-is-one-tough-coworker,news_website,A Sam Altman for All Seasons,Lizzie O’Leary,2026-04-12T09:20:00Z,2026-04-13T09:55:20Z,en,Global,"A Sam Altman for All Seasons Why Sam Altman is the face of artificial intelligence, not emotional intelligence. If you had as much trouble getting along with other humans as Sam Altman does, you too might be eager to issue in the artificial intelligence revolution. Guest: Andrew Marantz, staff writer for the …",53,"The article discusses how Sam Altman, a prominent figure in AI, struggles with emotional intelligence. The author suggests that his difficulties in interacting with others may contribute to his focus on artificial intelligence rather than human relationships. This raises questions about whether Altman's challenges with emotional intelligence are driving his work in AI. The tone of the piece is critical and implies that Altman's shortcomings in this area are notable.",llama3.1:8b,v1
article_0005,News9live.com,https://www.news9live.com/business/personal-finance/tcs-jobs-fresher-recruitment-drops-to-25k-amid-demand-uncertainty-in-it-sector-2955526,news_website,TCS jobs: Fresher recruitment drops to 25K amid demand uncertainty in IT sector,Biplob Ghosal,2026-04-12T09:13:58Z,2026-04-13T09:55:20Z,en,Global,"TCS jobs: Fresher recruitment drops to 25K amid demand uncertainty in IT sector TCS has scaled down fresher hiring for FY27 to 25,000 offers, significantly less than FY26's 44,000. This reduction is driven by demand uncertainty. Mumbai: Tata Consultancy Services (TCS), India’s largest IT company, has made job offers to only 25,000 freshers in 2026-27. The IT giant said that the hiring of more college graduates will depend up…",69,"Tata Consultancy Services (TCS) has scaled back its fresher recruitment for FY27 to 25,000 job offers, down from 44,000 in FY26 due to demand uncertainty in the IT sector. This marks a significant reduction in hiring by TCS, India's largest IT company. The company attributed the decrease to uncertain demand, which may impact future hiring of college graduates. TCS made 25,000 freshers job offers for 2026-27. The exact reason behind the reduced hiring is unclear, but uncertainty over market conditions is cited as a factor.",llama3.1:8b,v1
article_0006,Onefootball.com,https://onefootball.com/en/news/clement-turpin-chosen-for-atleti-barca-in-the-champions-league-42699120,news_website,"Clément Turpin, chosen for Atleti-Barça in the Champions League",OneFootball,2026-04-12T09:08:00Z,2026-04-13T09:55:20Z,en,Global,"Clément Turpin, chosen for Atleti-Barça in the Champions League UEFA has officially appointed French referee Clement Turpin to take charge of the crucial second leg of the Champions League quarter-final between Atlético de Madrid and FC Barcelona. Alongside him, ... UEFA has officially appointed French referee Clement Turpin to take charge of the crucial second leg of the Champions League quarter-final between Atlético de Madrid and FC Barcelona. Alongside him,…",70,"French referee Clément Turpin will officiate the second leg of the Champions League quarter-final between Atlético de Madrid and FC Barcelona. The match is a crucial one, with the teams tied after the first leg. Turpin was chosen for this assignment by UEFA. However, the text does not mention who will be alongside him as referees. Details about his assistants are missing from the article.",llama3.1:8b,v1
article_0007,NPR,https://www.npr.org/2026/04/12/nx-s1-5782074/project-hail-mary-nasa-space-science,news_website,The real space science behind 'Project Hail Mary',Tara Haelle,2026-04-12T09:00:00Z,2026-04-13T09:55:20Z,en,Global,The real space science behind 'Project Hail Mary' The science fiction blockbuster wowed audiences with its depiction of space travel and more. Here's what NASA staff and other scientists say about the basis for the amazing events of the film. This story contains major spoilers. The film Project Hail Mary has just blasted past the milestone of $400 million revenue globally and is generating early Oscar buzz. And the film's depiction of in…,73,"NASA staff and scientists have weighed in on the science behind the movie ""Project Hail Mary"", which has surpassed $400 million in global revenue. The film depicts a solo space mission to save Earth from an alien threat, but experts say that sending a single person into deep space is not currently feasible. However, NASA does have plans for future manned missions to Mars and other destinations. Some events in the film are inspired by real-life space exploration, such as the use of solar sails and the concept of a planetary defense system. The film's depiction of alien life forms has sparked debate among scientists about the likelihood of extraterrestrial life existing elsewhere in the universe.",llama3.1:8b,v1
article_0008,Onefootball.com,https://onefootball.com/en/news/top-class-choreos-how-fans-lit-up-europe-yesterday-42699056,news_website,Top-class choreos! How fans lit up Europe yesterday,OneFootball,2026-04-12T08:57:00Z,2026-04-13T09:55:20Z,en,Global,"Top-class choreos! How fans lit up Europe yesterday Hardly anything in professional football is as fascinating as fan choreographies. And on yesterday’s football Saturday, fans across Europe once again put on quite a show in the stands – we picked ... Hardly anything in professional football is as fascinating as fan choreographies. And on yesterdays football Saturday, fans across Europe once again put on quite a show in the stands we picked out a …",75,"Fans across Europe created impressive choreographed displays at their teams' matches, showcasing their creativity and enthusiasm for the sport. The performances were part of yesterday's football action and have become a staple of professional football entertainment. The choreographies often involve intricate movements and patterns, executed by large groups of fans in unison. They add an extra layer of excitement to the match-day experience.",llama3.1:8b,v1
article_0009,The Times of India,https://economictimes.indiatimes.com/news/defence/west-asia-crisis-geopolitical-upheaval-to-top-agenda-at-3-day-naval-commanders-conference/articleshow/130204907.cms,news_website,"West Asia crisis, geopolitical upheaval to top agenda at 3-day naval commanders' conference",PTI,2026-04-12T08:36:16Z,2026-04-13T09:55:20Z,en,Global,"West Asia crisis, geopolitical upheaval to top agenda at 3-day naval commanders' conference Indian Navy top brass are convening in New Delhi to address the West Asia crisis and its impact on India's energy security. The three-day conclave will also focus on enhancing operational readiness, capability development, and fostering international cooperat… New Delhi: Top commanders of the Indian Navy will deliberate on implications of the West Asia crisis in the context of safeguarding India's energy security during a three-day conclave beginning Tuesd…",82,"The Indian Navy's top brass are meeting in New Delhi for a 3-day conference to discuss the West Asia crisis and its impact on the country's energy security. The conference will also focus on enhancing operational readiness and developing capabilities. Top commanders will deliberate on the implications of the crisis and how to safeguard India's energy supplies. The conclave aims to foster international cooperation. The meeting begins today, Tuesday.",llama3.1:8b,v1
article_0010,Securityaffairs.com,https://securityaffairs.com/190662/security/security-affairs-newsletter-round-572-by-pierluigi-paganini-international-edition.html,news_website,Security Affairs newsletter Round 572 by Pierluigi Paganini – INTERNATIONAL EDITION,Pierluigi Paganini,2026-04-12T08:34:05Z,2026-04-13T09:55:20Z,en,Global,"Security Affairs newsletter Round 572 by Pierluigi Paganini – INTERNATIONAL EDITION A new round of the weekly Security Affairs newsletter has arrived! Every week, the best security articles from Security Affairs are free in your email box. Enjoy a new round of the weekly SecurityAffairs newsletter, including the international press. Censys f… Security Affairs newsletter Round 572 by Pierluigi Paganini INTERNATIONAL EDITION Enjoy a new round of the weekly SecurityAffairs newsletter, including the international press. International Press …",78,A new edition of the Security Affairs newsletter has been released. It features top security articles and includes an international section with news from around the world. The newsletter is free to receive in email form every week. The latest edition is numbered 572. Censys and other topics are mentioned as part of the newsletter content.,llama3.1:8b,v1
article_0011,Hurriyet Daily News,https://www.hurriyetdailynews.com/electrification-at-the-core-of-energy-vision-says-minister-220923,news_website,"Electrification at the core of energy vision, says minister",hurriyetdailynews.com,2026-04-12T08:32:46Z,2026-04-13T09:55:20Z,en,Global,"Electrification at the core of energy vision, says minister “Türkiye is working on a long-term new energy architecture, and at the center of this vision, electrification will take the lead,” said Energy Minister Alparslan Bayraktar. KAYSER Türkiye is working on a long-term new energy architecture, and at the center of this vision, electrification will take the lead, said Energy Minister Alparslan Bayraktar. Speaking at events …",66,"Turkish Energy Minister Alparslan Bayraktar stated that electrification is key to the country's new energy architecture. He said that in this long-term plan, electrification will play a leading role. The government is working on a comprehensive energy vision. No further details were given about the specifics of this vision.",llama3.1:8b,v1
